{
  "schema_version": "1.0.0",
  "plan_id": "java-learning-system",
  "status": "ready_for_implementation",
  "date": "2026-09-23",
  "repository": {
    "url": "https://github.com/kamil-kazmierczak/java-learning",
    "branch": "develop",
    "pull_requests": false
  },
  "learner": {
    "experience_years": 6,
    "role": "Java Backend Developer",
    "experience_context": "Commercial software development",
    "goals": [
      "Understand Java and JVM mechanisms in depth.",
      "Find and fill gaps in existing knowledge."
    ],
    "ide": "IntelliJ IDEA",
    "jdk_distribution": "Eclipse Temurin",
    "jdk_version": 25,
    "daily_minutes": 30,
    "practice_within_session": true
  },
  "language": {
    "repository_prose": "en",
    "lesson_chat": "pl",
    "approval_review": "pl",
    "standard": "ASD-STE100",
    "standard_issue": 9,
    "automated_full_compliance_claim": false,
    "checker_selection": "open"
  },
  "progress_states": [
    {
      "value": "not_assessed",
      "meaning": "There is not enough evidence."
    },
    {
      "value": "learning",
      "meaning": "The learner needs help or has a known gap."
    },
    {
      "value": "applied_independently",
      "meaning": "The learner explained the mechanism and solved a new task without LLM hints."
    },
    {
      "value": "retained",
      "meaning": "The learner repeated this result after a delay."
    }
  ],
  "requirements": [
    {
      "id": "LRN-01",
      "area": "learning",
      "basis": "user_confirmed",
      "text": "Use one ChatGPT project for Java. Start each lesson in a new chat.",
      "verification": "Start a new chat and load the saved state."
    },
    {
      "id": "LRN-02",
      "area": "learning",
      "basis": "user_confirmed",
      "text": "Teach Java, the standard library, and the JVM. Use frameworks only when they help explain these subjects.",
      "verification": "Review the topic map and one lesson."
    },
    {
      "id": "LRN-03",
      "area": "learning",
      "basis": "user_confirmed",
      "text": "Use a short initial assessment. Assess each topic again before instruction.",
      "verification": "Record evidence from both types of assessment."
    },
    {
      "id": "LRN-04",
      "area": "learning",
      "basis": "user_confirmed",
      "text": "Propose the next topic and explain why it is useful. Let the learner accept, change, or defer it.",
      "verification": "Show the topic choice in the lesson record."
    },
    {
      "id": "LRN-05",
      "area": "learning",
      "basis": "user_confirmed",
      "text": "Keep instruction, practice, review, and lesson closure within the daily 30-minute session. Adjust their duration to the task.",
      "verification": "Record unfinished work for a later session."
    },
    {
      "id": "LRN-06",
      "area": "learning",
      "basis": "user_confirmed",
      "text": "Teach mechanisms that apply across Java versions. State relevant version differences.",
      "verification": "Record the JDK version when a result depends on it."
    },
    {
      "id": "LRN-07",
      "area": "learning",
      "basis": "user_confirmed",
      "text": "Give a guiding question first. Then give a specific hint, a partial example, and a full explanation as needed.",
      "verification": "Record the help given. Use a new task after a full explanation."
    },
    {
      "id": "LRN-08",
      "area": "learning",
      "basis": "user_confirmed",
      "text": "Let the learner request an explanation before all hint steps are complete.",
      "verification": "Review the learner request and the tutor response."
    },
    {
      "id": "LRN-09",
      "area": "learning",
      "basis": "user_confirmed",
      "text": "Assess understanding, use in practice, use in a new task, and recall after a delay.",
      "verification": "Link each progress change to evidence."
    },
    {
      "id": "LRN-10",
      "area": "learning",
      "basis": "user_confirmed",
      "text": "Allow the IDE, tests, and documentation during independent practical tasks. Do not give LLM hints during these tasks.",
      "verification": "Record the resources and hints used."
    },
    {
      "id": "LRN-11",
      "area": "learning",
      "basis": "user_confirmed",
      "text": "Use the agreed progress states. Record a deferred topic separately from its progress state.",
      "verification": "Check that a deferred topic is not marked as mastered."
    },
    {
      "id": "LRN-12",
      "area": "learning",
      "basis": "user_confirmed",
      "text": "Use recall tasks and later review tasks. Put these tasks inside lesson time.",
      "verification": "Store review results and the next proposed review."
    },
    {
      "id": "LRN-13",
      "area": "learning",
      "basis": "user_confirmed",
      "text": "Use chat for short answers and results. Store larger exercises in the repository.",
      "verification": "Link each larger exercise to its lesson."
    },
    {
      "id": "CTX-01",
      "area": "context",
      "basis": "user_confirmed",
      "text": "Use AGENTS.md as the entry file. Include a link to each lesson file.",
      "verification": "Compare the lesson files with the lesson index."
    },
    {
      "id": "CTX-02",
      "area": "context",
      "basis": "user_confirmed",
      "text": "Store each lesson in a separate JSON file. Load only the files needed for the current task.",
      "verification": "Review the file list used for a lesson."
    },
    {
      "id": "CTX-03",
      "area": "context",
      "basis": "user_confirmed",
      "text": "Keep the current state small. Store detailed evidence in topic and lesson files.",
      "verification": "The next tutor can resume without reading all lessons."
    },
    {
      "id": "CTX-04",
      "area": "context",
      "basis": "derived_design",
      "text": "Put an explicit repository read instruction in the ChatGPT project setup.",
      "verification": "A new chat reads AGENTS.md before it starts instruction."
    },
    {
      "id": "CTX-05",
      "area": "context",
      "basis": "user_confirmed",
      "text": "Use repository records for the learner profile, agreed rules, and progress. Use official Java sources for technical facts.",
      "verification": "Keep source links with technical statements that need verification."
    },
    {
      "id": "DATA-01",
      "area": "data",
      "basis": "user_confirmed",
      "text": "Use JSON with a defined JSON Schema for each record type.",
      "verification": "Reject data with missing fields, unknown fields, or incorrect types."
    },
    {
      "id": "DATA-02",
      "area": "data",
      "basis": "user_confirmed",
      "text": "Define field meaning, allowed values, IDs, dates, empty values, and schema versions.",
      "verification": "Provide a schema and a separate valid example for each record type."
    },
    {
      "id": "DATA-03",
      "area": "data",
      "basis": "user_confirmed",
      "text": "Keep observations separate from tutor assessments. Record uncertainty when evidence is incomplete.",
      "verification": "Inspect a record with an uncertain assessment."
    },
    {
      "id": "DATA-04",
      "area": "data",
      "basis": "user_confirmed",
      "text": "Record tasks, errors, help, progress evidence, sources, unfinished work, and the next proposed step in each lesson.",
      "verification": "Validate a complete lesson record."
    },
    {
      "id": "DATA-05",
      "area": "data",
      "basis": "user_confirmed",
      "text": "Do not change a schema to make a failed lesson record pass. Request approval for format changes.",
      "verification": "A format change has an approved plan for old records."
    },
    {
      "id": "DATA-06",
      "area": "data",
      "basis": "derived_design",
      "text": "Keep example records separate from real learner records.",
      "verification": "Example results do not change learner progress."
    },
    {
      "id": "LANG-01",
      "area": "language",
      "basis": "user_confirmed",
      "text": "Write repository prose in English. Use ASD-STE100 Issue 9 as the language standard.",
      "verification": "Review English prose against the standard and the declared rule coverage."
    },
    {
      "id": "LANG-02",
      "area": "language",
      "basis": "user_confirmed",
      "text": "Teach in Polish. Present lesson summaries and proposed progress changes in Polish for review.",
      "verification": "The learner can review meaning without reading JSON."
    },
    {
      "id": "LANG-03",
      "area": "language",
      "basis": "user_confirmed",
      "text": "Use a controlled glossary for Java and JVM terms. Keep term meanings consistent.",
      "verification": "Report unapproved terms and inconsistent names."
    },
    {
      "id": "LANG-04",
      "area": "language",
      "basis": "user_confirmed",
      "text": "Use direct instructions and evidence-based reports. Remove generic praise, filler, slogans, and repeated statements.",
      "verification": "Apply the editorial rules and review meaning."
    },
    {
      "id": "LANG-05",
      "area": "language",
      "basis": "derived_design",
      "text": "Do not rewrite code, API names, IDs, or exact source quotations to satisfy prose rules.",
      "verification": "Keep these fields separate from prose fields."
    },
    {
      "id": "LANG-06",
      "area": "language",
      "basis": "user_confirmed",
      "text": "Report which STE rules were checked and which need human review. Do not claim full compliance from a word filter.",
      "verification": "The report states automated coverage and manual review limits."
    },
    {
      "id": "GIT-01",
      "area": "repository",
      "basis": "user_confirmed",
      "text": "Store approved work in kamil-kazmierczak/java-learning on develop. Do not use pull requests.",
      "verification": "Check the branch and the commit."
    },
    {